Row Sort ID,Control ID,Statement ID,Control Statement,Supplemental Guidance
ac-01-,AC-1,,,"Access control policy and procedures address the controls in the AC family that are implemented within systems and organizations. The risk management strategy is an important factor in establishing such policies and procedures. Policies and procedures contribute to security and privacy assurance. Therefore, it is important that security and privacy programs collaborate on the development of access control policy and procedures. Security and privacy program policies and procedures at the organization level are preferable, in general, and may obviate the need for mission- or system-specific policies and procedures. The policy can be included as part of the general security and privacy policy or be represented by multiple policies reflecting the complex nature of organizations. Procedures can be established for security and privacy programs, for mission or business processes, and for systems, if needed. Procedures describe how the policies or controls are implemented and can be directed at the individual or role that is the object of the procedure. Procedures can be documented in system security and privacy plans or in one or more separate documents. Events that may precipitate an update to access control policy and procedures include assessment or audit findings, security incidents or breaches, or changes in laws, executive orders, directives, regulations, policies, standards, and guidelines. Simply restating controls does not constitute an organizational policy or procedure."
ac-01-A,AC-1,A,"Develop, document, and disseminate to [Assignment: organization-defined organization-defined personnel or roles]:",
ac-01-A.1,AC-1,A.1,"[Selection: organization-level, mission/business process-level, system-level] access control policy that:",
ac-01-A.1.A,AC-1,A.1.A,"Addresses purpose, scope, roles, responsibilities, management commitment, coordination among organizational entities, and compliance; and",
ac-01-A.1.B,AC-1,A.1.B,"Is consistent with applicable laws, executive orders, directives, regulations, policies, standards, and guidelines; and",
ac-01-A.2,AC-1,A.2,Procedures to facilitate the implementation of the access control policy and the associated access controls;,
ac-01-B,AC-1,B,"Designate an [Assignment: organization-defined official] to manage the development, documentation, and dissemination of the access control policy and procedures; and",
ac-01-C,AC-1,C,Review and update the current access control:,
ac-01-C.1,AC-1,C.1,Policy [Assignment: organization-defined frequency] and following [Assignment: organization-defined events] ; and,
ac-01-C.2,AC-1,C.2,Procedures [Assignment: organization-defined frequency] and following [Assignment: organization-defined events].,
ac-02-,AC-2,,,"Examples of system account types include individual, shared, group, system, guest, anonymous, emergency, developer, temporary, and service. Identification of authorized system users and the specification of access privileges reflect the requirements in other controls in the security plan. Users requiring administrative privileges on system accounts receive additional scrutiny by organizational personnel responsible for approving such accounts and privileged access, including system owner, mission or business owner, senior agency information security officer, or senior agency official for privacy. Types of accounts that organizations may wish to prohibit due to increased risk include shared, group, emergency, anonymous, temporary, and guest accounts.

Where access involves personally identifiable information, security programs collaborate with the senior agency official for privacy to establish the specific conditions for group and role membership; specify authorized users, group and role membership, and access authorizations for each account; and create, adjust, or remove system accounts in accordance with organizational policies. Policies can include such information as account expiration dates or other factors that trigger the disabling of accounts. Organizations may choose to define access privileges or other attributes by account, type of account, or a combination of the two. Examples of other attributes required for authorizing access include restrictions on time of day, day of week, and point of origin. In defining other system account attributes, organizations consider system-related requirements and mission/business requirements. Failure to consider these factors could affect system availability.

Temporary and emergency accounts are intended for short-term use. Organizations establish temporary accounts as part of normal account activation procedures when there is a need for short-term accounts without the demand for immediacy in account activation. Organizations establish emergency accounts in response to crisis situations and with the need for rapid account activation. Therefore, emergency account activation may bypass normal account authorization processes. Emergency and temporary accounts are not to be confused with infrequently used accounts, including local logon accounts used for special tasks or when network resources are unavailable (may also be known as accounts of last resort). Such accounts remain available and are not subject to automatic disabling or removal dates. Conditions for disabling or deactivating accounts include when shared/group, emergency, or temporary accounts are no longer required and when individuals are transferred or terminated. Changing shared/group authenticators when members leave the group is intended to ensure that former group members do not retain access to the shared or group account. Some types of system accounts may require specialized training."
ac-02-A,AC-2,A,Define and document the types of accounts allowed and specifically prohibited for use within the system;,
ac-02-B,AC-2,B,Assign account managers and data custodians;,
ac-02-C,AC-2,C,Require [Assignment: organization-defined prerequisites and criteria] for group and role membership;,
ac-02-D,AC-2,D,Specify:,
ac-02-D.1,AC-2,D.1,Authorized users of the system;,
ac-02-D.2,AC-2,D.2,Group and role membership; and,
ac-02-D.3,AC-2,D.3,"Access authorizations (i.e., privileges) and [Assignment: organization-defined attributes (as required)] for each account;",
ac-02-E,AC-2,E,Require approvals by [Assignment: organization-defined personnel or roles] for requests to create accounts;,
ac-02-F,AC-2,F,"Create, enable, modify, disable, and remove accounts in accordance with [Assignment: organization-defined policy, procedures, prerequisites, and criteria];",
ac-02-G,AC-2,G,Monitor the use of accounts;,
ac-02-H,AC-2,H,Notify account managers and [Assignment: organization-defined personnel or roles] within:,
ac-02-H.1,AC-2,H.1,[Assignment: organization-defined time period] when accounts are no longer required or dormant;,
ac-02-H.2,AC-2,H.2,[Assignment: organization-defined time period] when users are terminated or transferred; and,
ac-02-H.3,AC-2,H.3,[Assignment: organization-defined time period] when system usage or need-to-know changes for an individual;,
ac-02-I,AC-2,I,Authorize access to the system based on:,
ac-02-I.1,AC-2,I.1,A valid access authorization;,
ac-02-I.2,AC-2,I.2,Intended system usage; and,
ac-02-I.3,AC-2,I.3,[Assignment: organization-defined attributes (as required)];,
ac-02-J,AC-2,J,Review accounts for compliance with account management requirements [Assignment: organization-defined frequency];,
ac-02-K,AC-2,K,Establish and implement a process for changing shared or group account authenticators (if deployed) when individuals are removed from the group; and,
ac-02-L,AC-2,L,Align account management processes with personnel termination and transfer processes.,
ac-02.03-,AC-2.3,,Disable accounts within [Assignment: organization-defined time period] when the accounts:,"Disabling expired, inactive, or otherwise anomalous accounts supports the concepts of least privilege and least functionality which reduce the attack surface of the system."
ac-02.03-A,AC-2.3,A,Have expired;,
ac-02.03-B,AC-2.3,B,Are no longer associated with a user or individual;,
ac-02.03-C,AC-2.3,C,Are in violation of organizational policy; or,
ac-02.03-D,AC-2.3,D,Have been inactive for [Assignment: organization-defined time period].,
ac-02.05-,AC-2.5,,Require that users log out when [Assignment: organization-defined time period of expected inactivity or description of when to log out].,Inactivity logout is behavior- or policy-based and requires users to take physical action to log out when they are expecting inactivity longer than the defined period. Automatic enforcement of inactivity logout is addressed by [AC-11](#ac-11).
ac-02.13-,AC-2.13,,Disable accounts of individuals within [Assignment: organization-defined time period] of discovery of [Assignment: organization-defined significant risks].,"Users who pose a significant security and/or privacy risk include individuals for whom reliable evidence indicates either the intention to use authorized access to systems to cause harm or through whom adversaries will cause harm. Such harm includes adverse impacts to organizational operations, organizational assets, individuals, other organizations, or the Nation. Close coordination among system administrators, legal staff, human resource managers, and authorizing officials is essential when disabling system accounts for high-risk individuals."
ac-03-,AC-3,,Enforce approved authorizations for logical access to information and system resources in accordance with applicable access control policies.,"Access control policies control access between active entities or subjects (i.e., users or processes acting on behalf of users) and passive entities or objects (i.e., devices, files, records, domains) in organizational systems. In addition to enforcing authorized access at the system level and recognizing that systems can host many applications and services in support of mission and business functions, access enforcement mechanisms can also be employed at the application and service level to provide increased information security and privacy. In contrast to logical access controls that are implemented within the system, physical access controls are addressed by the controls in the Physical and Environmental Protection ( [PE](#pe) ) family."
ac-04-,AC-4,,Enforce approved authorizations for controlling the flow of information within the system and between connected systems based on [Assignment: organization-defined information flow control policies].,"Information flow control regulates where information can travel within a system and between systems (in contrast to who is allowed to access the information) and without regard to subsequent accesses to that information. Flow control restrictions include blocking external traffic that claims to be from within the organization, keeping export-controlled information from being transmitted in the clear to the Internet, restricting web requests that are not from the internal web proxy server, and limiting information transfers between organizations based on data structures and content. Transferring information between organizations may require an agreement specifying how the information flow is enforced (see [CA-3](#ca-3) ). Transferring information between systems in different security or privacy domains with different security or privacy policies introduces the risk that such transfers violate one or more domain security or privacy policies. In such situations, information owners/stewards provide guidance at designated policy enforcement points between connected systems. Organizations consider mandating specific architectural solutions to enforce specific security and privacy policies. Enforcement includes prohibiting information transfers between connected systems (i.e., allowing access only), verifying write permissions before accepting information from another security or privacy domain or connected system, employing hardware mechanisms to enforce one-way information flows, and implementing trustworthy regrading mechanisms to reassign security or privacy attributes and labels.

Organizations commonly employ information flow control policies and enforcement mechanisms to control the flow of information between designated sources and destinations within systems and between connected systems. Flow control is based on the characteristics of the information and/or the information path. Enforcement occurs, for example, in boundary protection devices that employ rule sets or establish configuration settings that restrict system services, provide a packet-filtering capability based on header information, or provide a message-filtering capability based on message content. Organizations also consider the trustworthiness of filtering and/or inspection mechanisms (i.e., hardware, firmware, and software components) that are critical to information flow enforcement. Control enhancements 3 through 32 primarily address cross-domain solution needs that focus on more advanced filtering techniques, in-depth analysis, and stronger flow enforcement mechanisms implemented in cross-domain products, such as high-assurance guards. Such capabilities are generally not available in commercial off-the-shelf products. Information flow enforcement also applies to control plane traffic (e.g., routing and DNS)."
ac-05-,AC-5,,,"Separation of duties addresses the potential for abuse of authorized privileges and helps to reduce the risk of malevolent activity without collusion. Separation of duties includes dividing mission or business functions and support functions among different individuals or roles, conducting system support functions with different individuals, and ensuring that security personnel who administer access control functions do not also administer audit functions. Because separation of duty violations can span systems and application domains, organizations consider the entirety of systems and system components when developing policy on separation of duties. Separation of duties is enforced through the account management activities in [AC-2](#ac-2) , access control mechanisms in [AC-3](#ac-3) , and identity management activities in [IA-2](#ia-2), [IA-4](#ia-4) , and [IA-12](#ia-12)."
ac-05-A,AC-5,A,Identify and document [Assignment: organization-defined duties of individuals requiring separation] ; and,
ac-05-B,AC-5,B,Define system access authorizations to support separation of duties.,
ac-06-,AC-6,,"Employ the principle of least privilege, allowing only authorized accesses for users (or processes acting on behalf of users) that are necessary to accomplish assigned organizational tasks.","Organizations employ least privilege for specific duties and systems. The principle of least privilege is also applied to system processes, ensuring that the processes have access to systems and operate at privilege levels no higher than necessary to accomplish organizational missions or business functions. Organizations consider the creation of additional processes, roles, and accounts as necessary to achieve least privilege. Organizations apply least privilege to the development, implementation, and operation of organizational systems."
ac-06.01-,AC-6.1,,Authorize access for [Assignment: organization-defined individuals or roles] to:,"Security functions include establishing system accounts, configuring access authorizations (i.e., permissions, privileges), configuring settings for events to be audited, and establishing intrusion detection parameters. Security-relevant information includes filtering rules for routers or firewalls, configuration parameters for security services, cryptographic key management information, and access control lists. Authorized personnel include security administrators, system administrators, system security officers, system programmers, and other privileged users."
ac-06.01-A,AC-6.1,A,"[Assignment: organization-defined organization-defined security functions (deployed in hardware, software, and firmware)] ; and",
ac-06.01-B,AC-6.1,B,[Assignment: organization-defined security-relevant information].,
ac-06.02-,AC-6.2,,"Require that users of system accounts (or roles) with access to [Assignment: organization-defined security functions or security-relevant information] use non-privileged accounts or roles, when accessing nonsecurity functions.","Requiring the use of non-privileged accounts when accessing nonsecurity functions limits exposure when operating from within privileged accounts or roles. The inclusion of roles addresses situations where organizations implement access control policies, such as role-based access control, and where a change of role provides the same degree of assurance in the change of access authorizations for the user and the processes acting on behalf of the user as would be provided by a change between a privileged and non-privileged account."
ac-06.05-,AC-6.5,,Restrict privileged accounts on the system to [Assignment: organization-defined personnel or roles].,"Privileged accounts, including super user accounts, are typically described as system administrator for various types of commercial off-the-shelf operating systems. Restricting privileged accounts to specific personnel or roles prevents day-to-day users from accessing privileged information or privileged functions. Organizations may differentiate in the application of restricting privileged accounts between allowed privileges for local accounts and for domain accounts provided that they retain the ability to control system configurations for key parameters and as otherwise necessary to sufficiently mitigate risk."
ac-06.07-,AC-6.7,,,"The need for certain assigned user privileges may change over time to reflect changes in organizational mission and business functions, environments of operation, technologies, or threats. A periodic review of assigned user privileges is necessary to determine if the rationale for assigning such privileges remains valid. If the need cannot be revalidated, organizations take appropriate corrective actions."
ac-06.07-A,AC-6.7,A,Review [Assignment: organization-defined frequency] the privileges assigned to [Assignment: organization-defined roles or classes of users] to validate the need for such privileges; and,
ac-06.07-B,AC-6.7,B,"Reassign or remove privileges, if necessary, to correctly reflect organizational mission and business needs.",
ac-06.09-,AC-6.9,,Log the execution of privileged functions.,"The misuse of privileged functions, either intentionally or unintentionally by authorized users or by unauthorized external entities that have compromised system accounts, is a serious and ongoing concern and can have significant adverse impacts on organizations. Logging and analyzing the use of privileged functions is one way to detect such misuse and, in doing so, help mitigate the risk from insider threats and the advanced persistent threat."
ac-06.10-,AC-6.10,,Prevent non-privileged users from executing privileged functions.,"Privileged functions include disabling, circumventing, or altering implemented security or privacy controls, establishing system accounts, performing system integrity checks, and administering cryptographic key management activities. Non-privileged users are individuals who do not possess appropriate authorizations. Privileged functions that require protection from non-privileged users include circumventing intrusion detection and prevention mechanisms or malicious code protection mechanisms. Preventing non-privileged users from executing privileged functions is enforced by [AC-3](#ac-3)."
ac-07-,AC-7,,,"The need to limit unsuccessful logon attempts and take subsequent action when the maximum number of attempts is exceeded applies regardless of whether the logon occurs via a local or network connection. Due to the potential for denial of service, automatic lockouts initiated by systems are usually temporary and automatically release after a predetermined, organization-defined time period. If a delay algorithm is selected, organizations may employ different algorithms for different components of the system based on the capabilities of those components. Responses to unsuccessful logon attempts may be implemented at the operating system and the application levels. Organization-defined actions that may be taken when the number of allowed consecutive invalid logon attempts is exceeded include prompting the user to answer a secret question in addition to the username and password, invoking a lockdown mode with limited user capabilities (instead of full lockout), allowing users to only logon from specified Internet Protocol (IP) addresses, requiring a CAPTCHA to prevent automated attacks, or applying user profiles such as location, time of day, IP address, device, or Media Access Control (MAC) address. If automatic system lockout or execution of a delay algorithm is not implemented in support of the availability objective, organizations consider a combination of other actions to help prevent brute force attacks. In addition to the above, organizations can prompt users to respond to a secret question before the number of allowed unsuccessful logon attempts is exceeded. Automatically unlocking an account after a specified period of time is generally not permitted. However, exceptions may be required based on operational mission or need."
ac-07-A,AC-7,A,Enforce a limit of [Assignment: organization-defined number] consecutive invalid logon attempts by a user during a [Assignment: organization-defined time period] ; and,
ac-07-B,AC-7,B,"Automatically [Selection: lock the account or node for [Assignment: organization-defined time period], lock the account or node until released by an administrator, delay next logon prompt per [Assignment: organization-defined delay algorithm], notify system administrator, take other [Assignment: organization-defined action]] when the maximum number of unsuccessful attempts is exceeded.",
ac-08-,AC-8,,,"System use notifications can be implemented using messages or warning banners displayed before individuals log in to systems. System use notifications are used only for access via logon interfaces with human users. Notifications are not required when human interfaces do not exist. Based on an assessment of risk, organizations consider whether or not a secondary system use notification is needed to access applications or other system resources after the initial network logon. Organizations consider system use notification messages or banners displayed in multiple languages based on organizational needs and the demographics of system users. Organizations consult with the privacy office for input regarding privacy messaging and the Office of the General Counsel or organizational equivalent for legal review and approval of warning banner content."
ac-08-A,AC-8,A,"Display [Assignment: organization-defined system use notification message or banner] to users before granting access to the system that provides privacy and security notices consistent with applicable laws, executive orders, directives, regulations, policies, standards, and guidelines and state that:",
ac-08-A.1,AC-8,A.1,Users are accessing a Government of Canada system;,
ac-08-A.2,AC-8,A.2,"System usage may be monitored, recorded, and subject to audit;",
ac-08-A.3,AC-8,A.3,Unauthorized use of the system is prohibited and subject to criminal and civil penalties; and,
ac-08-A.4,AC-8,A.4,"The relevant Personal Information Bank reference, if applicable;",
ac-08-A.5,AC-8,A.5,Legal authority for the collection of personal information;,
ac-08-A.6,AC-8,A.6,Any legal or administrative consequences for refusing to provide the personal information;,
ac-08-A.7,AC-8,A.7,"The rights of access to, correction and protection of personal information;",
ac-08-A.8,AC-8,A.8,How the information will be used; and,
ac-08-A.9,AC-8,A.9,The right to file a complaint to the Privacy Commissioner of Canada regarding the institution's handling of the individual's personal information.,
ac-08-B,AC-8,B,Retain the notification message or banner on the screen until users acknowledge the usage conditions and take explicit actions to log on to or further access the system; and,
ac-08-C,AC-8,C,For publicly accessible systems:,
ac-08-C.1,AC-8,C.1,"Display system use information [Assignment: organization-defined conditions] , before granting further access to the publicly accessible system;",
ac-08-C.2,AC-8,C.2,"Display references, if any, to monitoring, recording, or auditing that are consistent with privacy accommodations for such systems that generally prohibit those activities; and",
ac-08-C.3,AC-8,C.3,Include a description of the authorized uses of the system.,
ac-11-,AC-11,,,"Device locks are temporary actions taken to prevent logical access to organizational systems when users stop work and move away from the immediate vicinity of those systems but do not want to log out because of the temporary nature of their absences. Device locks can be implemented at the operating system level or at the application level. A proximity lock may be used to initiate the device lock (e.g., via a Bluetooth-enabled device or dongle). User-initiated device locking is behavior or policy-based and, as such, requires users to take physical action to initiate the device lock. Device locks are not an acceptable substitute for logging out of systems, such as when organizations require users to log out at the end of workdays."
ac-11-A,AC-11,A,"Prevent further access to the system by [Selection: initiating a device lock after [Assignment: organization-defined time period] of inactivity, requiring the user to initiate a device lock before leaving the system unattended] ; and",
