Row Sort ID,Control ID,Statement ID,Control Statement,Supplemental Guidance
ia-05.01-,IA-5.1,,For password-based authentication:,"Password-based authentication applies to passwords regardless of whether they are used in single-factor or multi-factor authentication. Long passwords or passphrases are preferable over shorter passwords. Enforced composition rules provide marginal security benefits while decreasing usability. However, organizations may choose to establish certain rules for password generation (e.g., minimum character length for long passwords) under certain circumstances and can enforce this requirement in IA-5(1)(h). Account recovery can occur, for example, in situations when a password is forgotten. Cryptographically protected passwords include salted one-way cryptographic hashes of passwords. The list of commonly used, compromised, or expected passwords includes passwords obtained from previous breach corpuses, dictionary words, and repetitive or sequential characters. The list includes context-specific words, such as the name of the service, username, and derivatives thereof."
ia-05.01-A,IA-5.1,A,"Maintain a list of commonly-used, expected, or compromised passwords and update the list [Assignment: organization-defined frequency] and when organizational passwords are suspected to have been compromised directly or indirectly;",
ia-05.01-B,IA-5.1,B,"Verify, when users create or update passwords, that the passwords are not found on the list of commonly-used, expected, or compromised passwords in IA-5(1)(a);",
ia-05.01-C,IA-5.1,C,Transmit passwords only over cryptographically-protected channels;,
ia-05.01-D,IA-5.1,D,"Store passwords using an approved salted key derivation function, preferably using a keyed hash;",
ia-05.01-E,IA-5.1,E,Require immediate selection of a new password upon account recovery;,
ia-05.01-F,IA-5.1,F,"Allow user selection of long passwords and passphrases, including spaces and all printable characters;",
ia-05.01-G,IA-5.1,G,Employ automated tools to assist the user in selecting strong password authenticators; and,
ia-05.01-H,IA-5.1,H,Enforce the following composition and complexity rules: [Assignment: organization-defined composition and complexity rules].,
ia-06-,IA-6,,Obscure feedback of authentication information during the authentication process to protect the information from possible exploitation and use by unauthorized individuals.,"Authentication feedback from systems does not provide information that would allow unauthorized individuals to compromise authentication mechanisms. For some types of systems, such as desktops or notebooks with relatively large monitors, the threat (referred to as shoulder surfing) may be significant. For other types of systems, such as mobile devices with small displays, the threat may be less significant and is balanced against the increased likelihood of typographic input errors due to small keyboards. Thus, the means for obscuring authentication feedback is selected accordingly. Obscuring authentication feedback includes displaying asterisks when users type passwords into input devices or displaying feedback for a very limited time before obscuring it."
ia-11-,IA-11,,Require users to re-authenticate when [Assignment: organization-defined circumstances or situations requiring re-authentication].,"In addition to the re-authentication requirements associated with device locks, organizations may require re-authentication of individuals in certain situations, including when roles, authenticators or credentials change, when security categories of systems change, when the execution of privileged functions occurs, after a fixed time period, or periodically."
ir-01-,IR-1,,,"Incident response policy and procedures address the controls in the IR family that are implemented within systems and organizations. The risk management strategy is an important factor in establishing such policies and procedures. Policies and procedures contribute to security and privacy assurance. Therefore, it is important that security and privacy programs collaborate on the development of incident response policy and procedures. Security and privacy program policies and procedures at the organization level are preferable, in general, and may obviate the need for mission- or system-specific policies and procedures. The policy can be included as part of the general security and privacy policy or be represented by multiple policies that reflect the complex nature of organizations. Procedures can be established for security and privacy programs, for mission or business processes, and for systems, if needed. Procedures describe how the policies or controls are implemented and can be directed at the individual or role that is the object of the procedure. Procedures can be documented in system security and privacy plans or in one or more separate documents. Events that may precipitate an update to incident response policy and procedures include assessment or audit findings, security incidents or breaches, or changes in laws, executive orders, directives, regulations, policies, standards, and guidelines. Simply restating controls does not constitute an organizational policy or procedure."
ir-01-A,IR-1,A,"Develop, document, and disseminate to [Assignment: organization-defined organization-defined personnel or roles]:",
ir-01-A.1,IR-1,A.1,"[Selection: organization-level, mission/business process-level, system-level] incident response policy that:",
ir-01-A.1.A,IR-1,A.1.A,"Addresses purpose, scope, roles, responsibilities, management commitment, coordination among organizational entities, and compliance; and",
ir-01-A.1.B,IR-1,A.1.B,"Is consistent with applicable laws, executive orders, directives, regulations, policies, standards, and guidelines; and",
ir-01-A.2,IR-1,A.2,Procedures to facilitate the implementation of the incident response policy and the associated incident response controls;,
ir-01-B,IR-1,B,"Designate an [Assignment: organization-defined official] to manage the development, documentation, and dissemination of the incident response policy and procedures; and",
ir-01-C,IR-1,C,Review and update the current incident response:,
ir-01-C.1,IR-1,C.1,Policy [Assignment: organization-defined frequency] and following [Assignment: organization-defined events] ; and,
ir-01-C.2,IR-1,C.2,Procedures [Assignment: organization-defined frequency] and following [Assignment: organization-defined events].,
ir-02-,IR-2,,,"Incident response training is associated with the assigned roles and responsibilities of organizational personnel to ensure that the appropriate content and level of detail are included in such training. For example, users may only need to know who to call or how to recognize an incident; system administrators may require additional training on how to handle incidents; and incident responders may receive more specific training on forensics, data collection techniques, reporting, system recovery, and system restoration. Incident response training includes user training in identifying and reporting suspicious activities from external and internal sources. Incident response training for users may be provided as part of [AT-2](#at-2) or [AT-3](#at-3) . Events that may precipitate an update to incident response training content include, but are not limited to, incident response plan testing or response to an actual incident (lessons learned), assessment or audit findings, or changes in applicable laws, executive orders, directives, regulations, policies, standards, and guidelines."
ir-02-A,IR-2,A,Provide incident response training to system users consistent with assigned roles and responsibilities:,
ir-02-A.1,IR-2,A.1,Within [Assignment: organization-defined time period] of assuming an incident response role or responsibility or acquiring system access;,
ir-02-A.2,IR-2,A.2,When required by system changes; and,
ir-02-A.3,IR-2,A.3,[Assignment: organization-defined frequency] thereafter; and,
ir-02-B,IR-2,B,Review and update incident response training content [Assignment: organization-defined frequency] and following [Assignment: organization-defined events].,
ir-03-,IR-3,,Test the effectiveness of the incident response capability for the system [Assignment: organization-defined frequency] using the following tests: [Assignment: organization-defined tests].,"Organizations test incident response capabilities to determine their effectiveness and identify potential weaknesses or deficiencies. Incident response testing includes the use of checklists, walk-through or tabletop exercises, and simulations (parallel or full interrupt). Incident response testing can include a determination of the effects on organizational operations and assets and individuals due to incident response. The use of qualitative and quantitative data aids in determining the effectiveness of incident response processes."
ir-04-,IR-4,,,"Organizations recognize that incident response capabilities are dependent on the capabilities of organizational systems and the mission and business processes being supported by those systems. Organizations consider incident response as part of the definition, design, and development of mission and business processes and systems. Incident-related information can be obtained from a variety of sources, including audit monitoring, physical access monitoring, and network monitoring; user or administrator reports; and reported supply chain events. An effective incident handling capability includes coordination among many organizational entities (e.g., mission or business owners, system owners, authorizing officials, human resources offices, physical security offices, personnel security offices, legal departments, risk executive [function], operations personnel, procurement offices). Suspected security incidents include the receipt of suspicious email communications that can contain malicious code. Suspected supply chain incidents include the insertion of counterfeit hardware or malicious code into organizational systems or system components. For federal agencies, an incident that involves personally identifiable information is considered a breach. A breach results in unauthorized disclosure, the loss of control, unauthorized acquisition, compromise, or a similar occurrence where a person other than an authorized user accesses or potentially accesses personally identifiable information or an authorized user accesses or potentially accesses such information for other than authorized purposes."
ir-04-A,IR-4,A,"Implement an incident handling capability for incidents that is consistent with the incident response plan and includes preparation, detection and analysis, containment, eradication, and recovery;",
ir-04-B,IR-4,B,Coordinate incident handling activities with contingency planning activities;,
ir-04-C,IR-4,C,"Incorporate lessons learned from ongoing incident handling activities into incident response procedures, training, and testing, and implement the resulting changes accordingly; and",
ir-04-D,IR-4,D,"Ensure the rigor, intensity, scope, and results of incident handling activities are comparable and predictable across the organization.",
ir-05-,IR-5,,Track and document incidents.,"Documenting incidents includes maintaining records about each incident, the status of the incident, and other pertinent information necessary for forensics as well as evaluating incident details, trends, and handling. Incident information can be obtained from a variety of sources, including network monitoring, incident reports, incident response teams, user complaints, supply chain partners, audit monitoring, physical access monitoring, and user and administrator reports. [IR-4](#ir-4) provides information on the types of incidents that are appropriate for monitoring."
ir-06-,IR-6,,,"The types of incidents reported, the content and timeliness of the reports, and the designated reporting authorities reflect applicable laws, executive orders, directives, regulations, policies, standards, and guidelines. Incident information can inform risk assessments, control effectiveness assessments, security requirements for acquisitions, and selection criteria for technology products."
ir-06-A,IR-6,A,Require personnel to report suspected incidents to the organizational incident response capability within [Assignment: organization-defined time period] ; and,
ir-06-B,IR-6,B,Report incident information to [Assignment: organization-defined authorities].,
ir-07-,IR-7,,"Provide an incident response support resource, integral to the organizational incident response capability, that offers advice and assistance to users of the system for the handling and reporting of incidents.","Incident response support resources provided by organizations include help desks, assistance groups, automated ticketing systems to open and track incident response tickets, and access to forensics services or consumer redress services, when required."
ir-08-,IR-8,,,"It is important that organizations develop and implement a coordinated approach to incident response. Organizational mission and business functions determine the structure of incident response capabilities. As part of the incident response capabilities, organizations consider the coordination and sharing of information with external organizations, including external service providers and other organizations involved in the supply chain. For incidents involving personally identifiable information (i.e., breaches), include a process to determine whether notice to oversight organizations or affected individuals is appropriate and provide that notice accordingly."
ir-08-A,IR-8,A,Develop an incident response plan that:,
ir-08-A.1,IR-8,A.1,Provides the organization with a roadmap for implementing its incident response capability;,
ir-08-A.10,IR-8,A.10,"Explicitly designates responsibility for incident response to [Assignment: organization-defined entities, personnel, or roles].",
ir-08-A.2,IR-8,A.2,Describes the structure and organization of the incident response capability;,
ir-08-A.3,IR-8,A.3,Provides a high-level approach for how the incident response capability fits into the overall organization;,
ir-08-A.4,IR-8,A.4,"Meets the unique requirements of the organization, which relate to mission, size, structure, and functions;",
ir-08-A.5,IR-8,A.5,Defines reportable incidents;,
ir-08-A.6,IR-8,A.6,Provides metrics for measuring the incident response capability within the organization;,
ir-08-A.7,IR-8,A.7,Defines the resources and management support needed to effectively maintain and mature an incident response capability;,
ir-08-A.8,IR-8,A.8,Addresses the sharing of incident information;,
ir-08-A.9,IR-8,A.9,Is reviewed and approved by [Assignment: organization-defined personnel or roles] [Assignment: organization-defined frequency] ; and,
ir-08-B,IR-8,B,Distribute copies of the incident response plan to [Assignment: organization-defined incident response personnel (identified by name and/or by role) and organizational elements];,
ir-08-C,IR-8,C,"Update the incident response plan to address system and organizational changes or problems encountered during plan implementation, execution, or testing;",
ir-08-D,IR-8,D,Communicate incident response plan changes to [Assignment: organization-defined organization-defined incident response personnel (identified by name and/or by role) and organizational elements] ; and,
ir-08-E,IR-8,E,Protect the incident response plan from unauthorized disclosure and modification.,
ma-01-,MA-1,,,"Maintenance policy and procedures address the controls in the MA family that are implemented within systems and organizations. The risk management strategy is an important factor in establishing such policies and procedures. Policies and procedures contribute to security and privacy assurance. Therefore, it is important that security and privacy programs collaborate on the development of maintenance policy and procedures. Security and privacy program policies and procedures at the organization level are preferable, in general, and may obviate the need for mission- or system-specific policies and procedures. The policy can be included as part of the general security and privacy policy or be represented by multiple policies that reflect the complex nature of organizations. Procedures can be established for security and privacy programs, for mission or business processes, and for systems, if needed. Procedures describe how the policies or controls are implemented and can be directed at the individual or role that is the object of the procedure. Procedures can be documented in system security and privacy plans or in one or more separate documents. Events that may precipitate an update to maintenance policy and procedures assessment or audit findings, security incidents or breaches, or changes in applicable laws, executive orders, directives, regulations, policies, standards, and guidelines. Simply restating controls does not constitute an organizational policy or procedure."
ma-01-A,MA-1,A,"Develop, document, and disseminate to [Assignment: organization-defined organization-defined personnel or roles]:",
ma-01-A.1,MA-1,A.1,"[Selection: organization-level, mission/business process-level, system-level] maintenance policy that:",
ma-01-A.1.A,MA-1,A.1.A,"Addresses purpose, scope, roles, responsibilities, management commitment, coordination among organizational entities, and compliance; and",
ma-01-A.1.B,MA-1,A.1.B,"Is consistent with applicable laws, executive orders, directives, regulations, policies, standards, and guidelines; and",
ma-01-A.2,MA-1,A.2,Procedures to facilitate the implementation of the maintenance policy and the associated maintenance controls;,
ma-01-B,MA-1,B,"Designate an [Assignment: organization-defined official] to manage the development, documentation, and dissemination of the maintenance policy and procedures; and",
ma-01-C,MA-1,C,Review and update the current maintenance:,
ma-01-C.1,MA-1,C.1,Policy [Assignment: organization-defined frequency] and following [Assignment: organization-defined events] ; and,
ma-01-C.2,MA-1,C.2,Procedures [Assignment: organization-defined frequency] and following [Assignment: organization-defined events].,
ma-03-,MA-3,,,"Approving, controlling, monitoring, and reviewing maintenance tools address security-related issues associated with maintenance tools that are not within system authorization boundaries and are used specifically for diagnostic and repair actions on organizational systems. Organizations have flexibility in determining roles for the approval of maintenance tools and how that approval is documented. A periodic review of maintenance tools facilitates the withdrawal of approval for outdated, unsupported, irrelevant, or no-longer-used tools. Maintenance tools can include hardware, software, and firmware items and may be pre-installed, brought in with maintenance personnel on media, cloud-based, or downloaded from a website. Such tools can be vehicles for transporting malicious code, either intentionally or unintentionally, into a facility and subsequently into systems. Maintenance tools can include hardware and software diagnostic test equipment and packet sniffers. The hardware and software components that support maintenance and are a part of the system (including the software implementing utilities such as ""ping,"" ""ls,"" ""ipconfig,"" or the hardware and software implementing the monitoring port of an Ethernet switch) are not addressed by maintenance tools."
ma-03-A,MA-3,A,"Approve, control, and monitor the use of system maintenance tools; and",
ma-03-B,MA-3,B,Review previously approved system maintenance tools [Assignment: organization-defined frequency].,
ma-03.01-,MA-3.1,,Inspect the maintenance tools used by maintenance personnel for improper or unauthorized modifications.,"Maintenance tools can be directly brought into a facility by maintenance personnel or downloaded from a vendor’s website. If, upon inspection of the maintenance tools, organizations determine that the tools have been modified in an improper manner or the tools contain malicious code, the incident is handled consistent with organizational policies and procedures for incident handling."
ma-03.02-,MA-3.2,,Check media containing diagnostic and test programs for malicious code before the media are used in the system.,"If, upon inspection of media containing maintenance, diagnostic, and test programs, organizations determine that the media contains malicious code, the incident is handled consistent with organizational incident handling policies and procedures."
ma-03.03-,MA-3.3,,Prevent the removal of maintenance equipment containing organizational information by:,Organizational information includes all information owned by organizations and any information provided to organizations for which the organizations serve as information stewards.
ma-03.03-A,MA-3.3,A,Verifying that there is no organizational information contained on the equipment;,
ma-03.03-B,MA-3.3,B,Sanitizing or destroying the equipment;,
ma-03.03-C,MA-3.3,C,Retaining the equipment within the facility; or,
ma-03.03-D,MA-3.3,D,Obtaining an exemption from [Assignment: organization-defined personnel or roles] explicitly authorizing removal of the equipment from the facility.,
ma-04-,MA-4,,,"Nonlocal maintenance and diagnostic activities are conducted by individuals who communicate through either an external or internal network. Local maintenance and diagnostic activities are carried out by individuals who are physically present at the system location and not communicating across a network connection. Authentication techniques used to establish nonlocal maintenance and diagnostic sessions reflect the network access requirements in [IA-2](#ia-2) . Strong authentication requires authenticators that are resistant to replay attacks and employ multi-factor authentication. Strong authenticators include PKI where certificates are stored on a token protected by a password, passphrase, or biometric. Enforcing requirements in [MA-4](#ma-4) is accomplished, in part, by other controls. [SP 800-63B](#e59c5a7c-8b1f-49ca-8de0-6ee0882180ce) provides additional guidance on strong authentication and authenticators."
ma-04-A,MA-4,A,Approve and monitor nonlocal maintenance and diagnostic activities;,
ma-04-B,MA-4,B,Allow the use of nonlocal maintenance and diagnostic tools only as consistent with organizational policy and documented in the security plan for the system;,
ma-04-C,MA-4,C,Employ strong authentication in the establishment of nonlocal maintenance and diagnostic sessions;,
ma-04-D,MA-4,D,Maintain records for nonlocal maintenance and diagnostic activities; and,
ma-04-E,MA-4,E,Terminate session and network connections when nonlocal maintenance is completed.,
ma-05-,MA-5,,,"Maintenance personnel refers to individuals who perform hardware or software maintenance on organizational systems, while [PE-2](#pe-2) addresses physical access for individuals whose maintenance duties place them within the physical protection perimeter of the systems. Technical competence of supervising individuals relates to the maintenance performed on the systems, while having required access authorizations refers to maintenance on and near the systems. Individuals not previously identified as authorized maintenance personnel—such as information technology manufacturers, vendors, systems integrators, and consultants—may require privileged access to organizational systems, such as when they are required to conduct maintenance activities with little or no notice. Based on organizational assessments of risk, organizations may issue temporary credentials to these individuals. Temporary credentials may be for one-time use or for very limited time periods."
ma-05-A,MA-5,A,Establish a process for maintenance personnel authorization and maintain a list of authorized maintenance organizations or personnel;,
ma-05-B,MA-5,B,Verify that non-escorted personnel performing maintenance on the system possess the required access authorizations; and,
ma-05-C,MA-5,C,Designate organizational personnel with required access authorizations and technical competence to supervise the maintenance activities of personnel who do not possess the required access authorizations.,
mp-01-,MP-1,,,"Media protection policy and procedures address the controls in the MP family that are implemented within systems and organizations. The risk management strategy is an important factor in establishing such policies and procedures. Policies and procedures contribute to security and privacy assurance. Therefore, it is important that security and privacy programs collaborate on the development of media protection policy and procedures. Security and privacy program policies and procedures at the organization level are preferable, in general, and may obviate the need for mission- or system-specific policies and procedures. The policy can be included as part of the general security and privacy policy or be represented by multiple policies that reflect the complex nature of organizations. Procedures can be established for security and privacy programs, for mission or business processes, and for systems, if needed. Procedures describe how the policies or controls are implemented and can be directed at the individual or role that is the object of the procedure. Procedures can be documented in system security and privacy plans or in one or more separate documents. Events that may precipitate an update to media protection policy and procedures include assessment or audit findings, security incidents or breaches, or changes in applicable laws, executive orders, directives, regulations, policies, standards, and guidelines. Simply restating controls does not constitute an organizational policy or procedure."
