Row Sort ID,Control ID,Statement ID,Control Statement,Supplemental Guidance
at-03-,AT-3,,,"Organizations determine the content of training based on the assigned roles and responsibilities of individuals as well as the security and privacy requirements of organizations and the systems to which personnel have authorized access, including technical training specifically tailored for assigned duties. Roles that may require role-based training include senior leaders or management officials (e.g., head of agency/chief executive officer, chief information officer, senior accountable official for risk management, senior agency information security officer, senior agency official for privacy), system owners; authorizing officials; system security officers; privacy officers; acquisition and procurement officials; enterprise architects; systems engineers; software developers; systems security engineers; privacy engineers; system, network, and database administrators; auditors; personnel conducting configuration management activities; personnel performing verification and validation activities; personnel with access to system-level software; control assessors; personnel with contingency planning and incident response duties; personnel with privacy management responsibilities; and personnel with access to personally identifiable information.

Comprehensive role-based training addresses management, operational, and technical roles and responsibilities covering physical, personnel, and technical controls. Role-based training also includes policies, procedures, tools, methods, and artifacts for the security and privacy roles defined. Organizations provide the training necessary for individuals to fulfill their responsibilities related to operations and supply chain risk management within the context of organizational security and privacy programs. Role-based training also applies to contractors who provide services to federal agencies. Types of training include web-based and computer-based training, classroom-style training, and hands-on training (including micro-training). Updating role-based training on a regular basis helps to ensure that the content remains relevant and effective. Events that may precipitate an update to role-based training content include, but are not limited to, assessment or audit findings, security incidents or breaches, or changes in applicable laws, executive orders, directives, regulations, policies, standards, and guidelines."
at-03-A,AT-3,A,Provide role-based security and privacy training to personnel with the following roles and responsibilities: [Assignment: organization-defined organization-defined roles and responsibilities]:,
at-03-A.1,AT-3,A.1,"Before authorizing access to the system, information, or performing assigned duties, and [Assignment: organization-defined frequency] thereafter; and",
at-03-A.2,AT-3,A.2,When required by system changes;,
at-03-B,AT-3,B,Update role-based training content [Assignment: organization-defined frequency] and following [Assignment: organization-defined events] ; and,
at-03-C,AT-3,C,Incorporate lessons learned from internal or external security incidents or breaches into role-based training.,
au-01-,AU-1,,,"Audit and accountability policy and procedures address the controls in the AU family that are implemented within systems and organizations. The risk management strategy is an important factor in establishing such policies and procedures. Policies and procedures contribute to security and privacy assurance. Therefore, it is important that security and privacy programs collaborate on the development of audit and accountability policy and procedures. Security and privacy program policies and procedures at the organization level are preferable, in general, and may obviate the need for mission- or system-specific policies and procedures. The policy can be included as part of the general security and privacy policy or be represented by multiple policies that reflect the complex nature of organizations. Procedures can be established for security and privacy programs, for mission or business processes, and for systems, if needed. Procedures describe how the policies or controls are implemented and can be directed at the individual or role that is the object of the procedure. Procedures can be documented in system security and privacy plans or in one or more separate documents. Events that may precipitate an update to audit and accountability policy and procedures include assessment or audit findings, security incidents or breaches, or changes in applicable laws, executive orders, directives, regulations, policies, standards, and guidelines. Simply restating controls does not constitute an organizational policy or procedure."
au-01-A,AU-1,A,"Develop, document, and disseminate to [Assignment: organization-defined organization-defined personnel or roles]:",
au-01-A.1,AU-1,A.1,"[Selection: organization-level, mission/business process-level, system-level] audit and accountability policy that:",
au-01-A.1.A,AU-1,A.1.A,"Addresses purpose, scope, roles, responsibilities, management commitment, coordination among organizational entities, and compliance; and",
au-01-A.1.B,AU-1,A.1.B,"Is consistent with applicable laws, executive orders, directives, regulations, policies, standards, and guidelines; and",
au-01-A.2,AU-1,A.2,Procedures to facilitate the implementation of the audit and accountability policy and the associated audit and accountability controls;,
au-01-B,AU-1,B,"Designate an [Assignment: organization-defined official] to manage the development, documentation, and dissemination of the audit and accountability policy and procedures; and",
au-01-C,AU-1,C,Review and update the current audit and accountability:,
au-01-C.1,AU-1,C.1,Policy [Assignment: organization-defined frequency] and following [Assignment: organization-defined events] ; and,
au-01-C.2,AU-1,C.2,Procedures [Assignment: organization-defined frequency] and following [Assignment: organization-defined events].,
au-02-,AU-2,,,"An event is an observable occurrence in a system. The types of events that require logging are those events that are significant and relevant to the security of systems and the privacy of individuals. Event logging also supports specific monitoring and auditing needs. Event types include password changes, failed logons or failed accesses related to systems, security or privacy attribute changes, administrative privilege usage, PIV credential usage, data action changes, query parameters, or external credential usage. In determining the set of event types that require logging, organizations consider the monitoring and auditing appropriate for each of the controls to be implemented. For completeness, event logging includes all protocols that are operational and supported by the system.

To balance monitoring and auditing requirements with other system needs, event logging requires identifying the subset of event types that are logged at a given point in time. For example, organizations may determine that systems need the capability to log every file access successful and unsuccessful, but not activate that capability except for specific circumstances due to the potential burden on system performance. The types of events that organizations desire to be logged may change. Reviewing and updating the set of logged events is necessary to help ensure that the events remain relevant and continue to support the needs of the organization. Organizations consider how the types of logging events can reveal information about individuals that may give rise to privacy risk and how best to mitigate such risks. For example, there is the potential to reveal personally identifiable information in the audit trail, especially if the logging event is based on patterns or time of usage.

Event logging requirements, including the need to log specific event types, may be referenced in other controls and control enhancements. These include [AC-2(4)](#ac-2.4), [AC-3(10)](#ac-3.10), [AC-6(9)](#ac-6.9), [AC-17(1)](#ac-17.1), [CM-3f](#cm-3_smt.f), [CM-5(1)](#cm-5.1), [IA-3(3)(b)](#ia-3.3_smt.b), [MA-4(1)](#ma-4.1), [MP-4(2)](#mp-4.2), [PE-3](#pe-3), [PM-21](#pm-21), [PT-7](#pt-7), [RA-8](#ra-8), [SC-7(9)](#sc-7.9), [SC-7(15)](#sc-7.15), [SI-3(8)](#si-3.8), [SI-4(22)](#si-4.22), [SI-7(8)](#si-7.8) , and [SI-10(1)](#si-10.1) . Organizations include event types that are required by applicable laws, executive orders, directives, policies, regulations, standards, and guidelines. Audit records can be generated at various levels, including at the packet level as information traverses the network. Selecting the appropriate level of event logging is an important part of a monitoring and auditing capability and can identify the root causes of problems. When defining event types, organizations consider the logging necessary to cover related event types, such as the steps in distributed, transaction-based processes and the actions that occur in service-oriented architectures."
au-02-A,AU-2,A,Identify the types of events that the system is capable of logging in support of the audit function: [Assignment: organization-defined event types that the system is capable of logging];,
au-02-B,AU-2,B,Coordinate the event logging function with other organizational entities requiring audit-related information to guide and inform the selection criteria for events to be logged;,
au-02-C,AU-2,C,Specify the following event types for logging within the system: [Assignment: organization-defined organization-defined event types (subset of the event types defined in [AU-2a.](#au-2_smt.a)) along with the frequency of (or situation requiring) logging for each identified event type];,
au-02-D,AU-2,D,Provide a rationale for why the event types selected for logging are deemed to be adequate to support after-the-fact investigations of incidents; and,
au-02-E,AU-2,E,Review and update the event types selected for logging [Assignment: organization-defined frequency].,
au-03-,AU-3,,Ensure that audit records contain information that establishes the following:,"Audit record content that may be necessary to support the auditing function includes event descriptions (item a), time stamps (item b), source and destination addresses (item c), user or process identifiers (items d and f), success or fail indications (item e), and filenames involved (items a, c, e, and f) . Event outcomes include indicators of event success or failure and event-specific results, such as the system security and privacy posture after the event occurred. Organizations consider how audit records can reveal information about individuals that may give rise to privacy risks and how best to mitigate such risks. For example, there is the potential to reveal personally identifiable information in the audit trail, especially if the trail records inputs or is based on patterns or time of usage."
au-03-A,AU-3,A,What type of event occurred;,
au-03-B,AU-3,B,When the event occurred;,
au-03-C,AU-3,C,Where the event occurred;,
au-03-D,AU-3,D,Source of the event;,
au-03-E,AU-3,E,Outcome of the event; and,
au-03-F,AU-3,F,"Identity of any individuals, subjects, or objects/entities associated with the event.",
au-03.01-,AU-3.1,,Generate audit records containing the following additional information: [Assignment: organization-defined additional information].,"The ability to add information generated in audit records is dependent on system functionality to configure the audit record content. Organizations may consider additional information in audit records including, but not limited to, access control or flow control rules invoked and individual identities of group account users. Organizations may also consider limiting additional audit record information to only information that is explicitly needed for audit requirements. This facilitates the use of audit trails and audit logs by not including information in audit records that could potentially be misleading, make it more difficult to locate information of interest, or increase the risk to individuals' privacy."
au-05-,AU-5,,,"Audit logging process failures include software and hardware errors, failures in audit log capturing mechanisms, and reaching or exceeding audit log storage capacity. Organization-defined actions include overwriting oldest audit records, shutting down the system, and stopping the generation of audit records. Organizations may choose to define additional actions for audit logging process failures based on the type of failure, the location of the failure, the severity of the failure, or a combination of such factors. When the audit logging process failure is related to storage, the response is carried out for the audit log storage repository (i.e., the distinct system component where the audit logs are stored), the system on which the audit logs reside, the total audit log storage capacity of the organization (i.e., all audit log storage repositories combined), or all three. Organizations may decide to take no additional actions after alerting designated roles or personnel."
au-05-A,AU-5,A,Alert [Assignment: organization-defined personnel or roles] within [Assignment: organization-defined time period] in the event of an audit logging process failure; and,
au-05-B,AU-5,B,Take the following additional actions: [Assignment: organization-defined additional actions].,
au-06-,AU-6,,,"Audit record review, analysis, and reporting covers information security- and privacy-related logging performed by organizations, including logging that results from the monitoring of account usage, remote access, wireless connectivity, mobile device connection, configuration settings, system component inventory, use of maintenance tools and non-local maintenance, physical access, temperature and humidity, equipment delivery and removal, communications at system interfaces, and use of mobile code or Voice over Internet Protocol (VoIP). Findings can be reported to organizational entities that include the incident response team, help desk, and security or privacy offices. If organizations are prohibited from reviewing and analyzing audit records or unable to conduct such activities, the review or analysis may be carried out by other organizations granted such authority. The frequency, scope, and/or depth of the audit record review, analysis, and reporting may be adjusted to meet organizational needs based on new information received."
au-06-A,AU-6,A,Review and analyze system audit records [Assignment: organization-defined frequency] for indications of [Assignment: organization-defined inappropriate or unusual activity] and the potential impact of the inappropriate or unusual activity;,
au-06-B,AU-6,B,Report findings to [Assignment: organization-defined personnel or roles] ; and,
au-06-C,AU-6,C,"Adjust the level of audit record review, analysis, and reporting within the system when there is a change in risk based on law enforcement information, intelligence information, or other credible sources of information.",
au-06.03-,AU-6.3,,Analyze and correlate audit records across different repositories to gain organization-wide situational awareness.,"Organization-wide situational awareness includes awareness across all three levels of risk management (i.e., organizational level, mission/business process level, and information system level) and supports cross-organization awareness."
au-07-,AU-7,,Provide and implement an audit record reduction and report generation capability that:,Audit record reduction is a process that manipulates collected audit log information and organizes it into a summary format that is more meaningful to analysts. Audit record reduction and report generation capabilities do not always emanate from the same system or from the same organizational entities that conduct audit logging activities. The audit record reduction capability includes modern data mining techniques with advanced data filters to identify anomalous behavior in audit records. The report generation capability provided by the system can generate customizable reports. Time ordering of audit records can be an issue if the granularity of the timestamp in the record is insufficient.
au-07-A,AU-7,A,"Supports on-demand audit record review, analysis, and reporting requirements and after-the-fact investigations of incidents; and",
au-07-B,AU-7,B,Does not alter the original content or time ordering of audit records.,
au-08-,AU-8,,,"Time stamps generated by the system include date and time. Time is commonly expressed in Coordinated Universal Time (UTC), a modern continuation of Greenwich Mean Time (GMT), or local time with an offset from UTC. Granularity of time measurements refers to the degree of synchronization between system clocks and reference clocks (e.g., clocks synchronizing within hundreds of milliseconds or tens of milliseconds). Organizations may define different time granularities for different system components. Time service can be critical to other security capabilities such as access control and identification and authentication, depending on the nature of the mechanisms used to support those capabilities."
au-08-A,AU-8,A,Use internal system clocks to generate time stamps for audit records; and,
au-08-B,AU-8,B,"Record time stamps for audit records that meet [Assignment: organization-defined granularity of time measurement] and that use Coordinated Universal Time, have a fixed local time offset from Coordinated Universal Time, or that include the local time offset as part of the time stamp.",
au-09-,AU-9,,,"Audit information includes all information needed to successfully audit system activity, such as audit records, audit log settings, audit reports, and personally identifiable information. Audit logging tools are those programs and devices used to conduct system audit and logging activities. Protection of audit information focuses on technical protection and limits the ability to access and execute audit logging tools to authorized individuals. Physical protection of audit information is addressed by both media protection controls and physical and environmental protection controls."
au-09-A,AU-9,A,"Protect audit information and audit logging tools from unauthorized access, modification, and deletion; and",
au-09-B,AU-9,B,"Alert [Assignment: organization-defined personnel or roles] upon detection of unauthorized access, modification, or deletion of audit information.",
au-09.04-,AU-9.4,,Authorize access to management of audit logging functionality to only [Assignment: organization-defined subset of privileged users or roles].,Individuals or roles with privileged access to a system and who are also the subject of an audit by that system may affect the reliability of the audit information by inhibiting audit activities or modifying audit records. Requiring privileged access to be further defined between audit-related privileges and other privileges limits the number of users or roles with audit-related privileges.
au-11-,AU-11,,Retain audit records for [Assignment: organization-defined time period consistent with records retention policy] to provide support for after-the-fact investigations of incidents and to meet regulatory and organizational information retention requirements.,"Organizations retain audit records until it is determined that the records are no longer needed for administrative, legal, audit, or other operational purposes. This includes the retention and availability of audit records relative to Freedom of Information Act (FOIA) requests, subpoenas, and law enforcement actions. Organizations develop standard categories of audit records relative to such types of actions and standard response processes for each type of action. The National Archives and Records Administration (NARA) General Records Schedules provide federal policy on records retention."
au-12-,AU-12,,,Audit records can be generated from many different system components. The event types specified in [AU-2d](#au-2_smt.d) are the event types for which audit logs are to be generated and are a subset of all event types for which the system can generate audit records.
au-12-A,AU-12,A,Provide audit record generation capability for the event types the system is capable of auditing as defined in [AU-2a](#au-2_smt.a) on [Assignment: organization-defined system components];,
au-12-B,AU-12,B,Allow [Assignment: organization-defined personnel or roles] to select the event types that are to be logged by specific components of the system; and,
au-12-C,AU-12,C,Generate audit records for the event types defined in [AU-2c](#au-2_smt.c) that include the audit record content defined in [AU-3](#au-3).,
ca-01-,CA-1,,,"Assessment, authorization, and monitoring policy and procedures address the controls in the CA family that are implemented within systems and organizations. The risk management strategy is an important factor in establishing such policies and procedures. Policies and procedures contribute to security and privacy assurance. Therefore, it is important that security and privacy programs collaborate on the development of assessment, authorization, and monitoring policy and procedures. Security and privacy program policies and procedures at the organization level are preferable, in general, and may obviate the need for mission- or system-specific policies and procedures. The policy can be included as part of the general security and privacy policy or be represented by multiple policies that reflect the complex nature of organizations. Procedures can be established for security and privacy programs, for mission or business processes, and for systems, if needed. Procedures describe how the policies or controls are implemented and can be directed at the individual or role that is the object of the procedure. Procedures can be documented in system security and privacy plans or in one or more separate documents. Events that may precipitate an update to assessment, authorization, and monitoring policy and procedures include assessment or audit findings, security incidents or breaches, or changes in applicable laws, executive orders, directives, regulations, policies, standards, and guidelines. Simply restating controls does not constitute an organizational policy or procedure."
ca-01-A,CA-1,A,"Develop, document, and disseminate to [Assignment: organization-defined organization-defined personnel or roles]:",
ca-01-A.1,CA-1,A.1,"[Selection: organization-level, mission/business process-level, system-level] assessment, authorization, and monitoring policy that:",
ca-01-A.1.A,CA-1,A.1.A,"Addresses purpose, scope, roles, responsibilities, management commitment, coordination among organizational entities, and compliance; and",
ca-01-A.1.B,CA-1,A.1.B,"Is consistent with applicable laws, executive orders, directives, regulations, policies, standards, and guidelines; and",
ca-01-A.2,CA-1,A.2,"Procedures to facilitate the implementation of the assessment, authorization, and monitoring policy and the associated assessment, authorization, and monitoring controls;",
ca-01-B,CA-1,B,"Designate an [Assignment: organization-defined official] to manage the development, documentation, and dissemination of the assessment, authorization, and monitoring policy and procedures; and",
ca-01-C,CA-1,C,"Review and update the current assessment, authorization, and monitoring:",
ca-01-C.1,CA-1,C.1,Policy [Assignment: organization-defined frequency] and following [Assignment: organization-defined events] ; and,
ca-01-C.2,CA-1,C.2,Procedures [Assignment: organization-defined frequency] and following [Assignment: organization-defined events].,
