Row Sort ID,Control ID,Statement ID,Control Statement,Supplemental Guidance
ra-05-B,RA-5,B,Employ vulnerability monitoring tools and techniques that facilitate interoperability among tools and automate parts of the vulnerability management process by using standards for:,
ra-05-B.1,RA-5,B.1,"Enumerating platforms, software flaws, and improper configurations;",
ra-05-B.2,RA-5,B.2,Formatting checklists and test procedures; and,
ra-05-B.3,RA-5,B.3,Measuring vulnerability impact;,
ra-05-C,RA-5,C,Analyze vulnerability scan reports and results from vulnerability monitoring;,
ra-05-D,RA-5,D,Remediate legitimate vulnerabilities [Assignment: organization-defined response times] in accordance with an organizational assessment of risk;,
ra-05-E,RA-5,E,Share information obtained from the vulnerability monitoring process and control assessments with [Assignment: organization-defined personnel or roles] to help eliminate similar vulnerabilities in other systems; and,
ra-05-F,RA-5,F,Employ vulnerability monitoring tools that include the capability to readily update the vulnerabilities to be scanned.,
ra-05.02-,RA-5.2,,"Update the system vulnerabilities to be scanned [Selection: [Assignment: organization-defined frequency], prior to a new scan, when new vulnerabilities are identified and reported].","Due to the complexity of modern software, systems, and other factors, new vulnerabilities are discovered on a regular basis. It is important that newly discovered vulnerabilities are added to the list of vulnerabilities to be scanned to ensure that the organization can take steps to mitigate those vulnerabilities in a timely manner."
ra-07-,RA-7,,"Respond to findings from security and privacy assessments, monitoring, and audits in accordance with organizational risk tolerance.","Organizations have many options for responding to risk including mitigating risk by implementing new controls or strengthening existing controls, accepting risk with appropriate justification or rationale, sharing or transferring risk, or avoiding risk. The risk tolerance of the organization influences risk response decisions and actions. Risk response addresses the need to determine an appropriate response to risk before generating a plan of action and milestones entry. For example, the response may be to accept risk or reject risk, or it may be possible to mitigate the risk immediately so that a plan of action and milestones entry is not needed. However, if the risk response is to mitigate the risk, and the mitigation cannot be completed immediately, a plan of action and milestones entry is generated."
sa-01-,SA-1,,,"System and services acquisition policy and procedures address the controls in the SA family that are implemented within systems and organizations. The risk management strategy is an important factor in establishing such policies and procedures. Policies and procedures contribute to security and privacy assurance. Therefore, it is important that security and privacy programs collaborate on the development of system and services acquisition policy and procedures. Security and privacy program policies and procedures at the organization level are preferable, in general, and may obviate the need for mission- or system-specific policies and procedures. The policy can be included as part of the general security and privacy policy or be represented by multiple policies that reflect the complex nature of organizations. Procedures can be established for security and privacy programs, for mission or business processes, and for systems, if needed. Procedures describe how the policies or controls are implemented and can be directed at the individual or role that is the object of the procedure. Procedures can be documented in system security and privacy plans or in one or more separate documents. Events that may precipitate an update to system and services acquisition policy and procedures include assessment or audit findings, security incidents or breaches, or changes in laws, executive orders, directives, regulations, policies, standards, and guidelines. Simply restating controls does not constitute an organizational policy or procedure."
sa-01-A,SA-1,A,"Develop, document, and disseminate to [Assignment: organization-defined organization-defined personnel or roles]:",
sa-01-A.1,SA-1,A.1,"[Selection: organization-level, mission/business process-level, system-level] system and services acquisition policy that:",
sa-01-A.1.A,SA-1,A.1.A,"Addresses purpose, scope, roles, responsibilities, management commitment, coordination among organizational entities, and compliance; and",
sa-01-A.1.B,SA-1,A.1.B,"Is consistent with applicable laws, executive orders, directives, regulations, policies, standards, and guidelines; and",
sa-01-A.2,SA-1,A.2,Procedures to facilitate the implementation of the system and services acquisition policy and the associated system and services acquisition controls;,
sa-01-B,SA-1,B,"Designate an [Assignment: organization-defined official] to manage the development, documentation, and dissemination of the system and services acquisition policy and procedures; and",
sa-01-C,SA-1,C,Review and update the current system and services acquisition:,
sa-01-C.1,SA-1,C.1,Policy [Assignment: organization-defined frequency] and following [Assignment: organization-defined events] ; and,
sa-01-C.2,SA-1,C.2,Procedures [Assignment: organization-defined frequency] and following [Assignment: organization-defined events].,
sa-08-,SA-8,,"Apply the following systems security and privacy engineering principles in the specification, design, development, implementation, and modification of the system and system components: [Assignment: organization-defined organization-defined systems security and privacy engineering principles].","Systems security and privacy engineering principles are closely related to and implemented throughout the system development life cycle (see [SA-3](#sa-3) ). Organizations can apply systems security and privacy engineering principles to new systems under development or to systems undergoing upgrades. For existing systems, organizations apply systems security and privacy engineering principles to system upgrades and modifications to the extent feasible, given the current state of hardware, software, and firmware components within those systems.

The application of systems security and privacy engineering principles helps organizations develop trustworthy, secure, and resilient systems and reduces the susceptibility to disruptions, hazards, threats, and the creation of privacy problems for individuals. Examples of system security engineering principles include: developing layered protections; establishing security and privacy policies, architecture, and controls as the foundation for design and development; incorporating security and privacy requirements into the system development life cycle; delineating physical and logical security boundaries; ensuring that developers are trained on how to build secure software; tailoring controls to meet organizational needs; and performing threat modeling to identify use cases, threat agents, attack vectors and patterns, design patterns, and compensating controls needed to mitigate risk.

Organizations that apply systems security and privacy engineering concepts and principles can facilitate the development of trustworthy, secure systems, system components, and system services; reduce risk to acceptable levels; and make informed risk management decisions. System security engineering principles can also be used to protect against certain supply chain risks, including incorporating tamper-resistant hardware into a design."
sa-09-,SA-9,,,"External system services are provided by an external provider, and the organization has no direct control over the implementation of the required controls or the assessment of control effectiveness. Organizations establish relationships with external service providers in a variety of ways, including through business partnerships, contracts, interagency agreements, lines of business arrangements, licensing agreements, joint ventures, and supply chain exchanges. The responsibility for managing risks from the use of external system services remains with authorizing officials. For services external to organizations, a chain of trust requires that organizations establish and retain a certain level of confidence that each provider in the consumer-provider relationship provides adequate protection for the services rendered. The extent and nature of this chain of trust vary based on relationships between organizations and the external providers. Organizations document the basis for the trust relationships so that the relationships can be monitored. External system services documentation includes government, service providers, end user security roles and responsibilities, and service-level agreements. Service-level agreements define the expectations of performance for implemented controls, describe measurable outcomes, and identify remedies and response requirements for identified instances of noncompliance."
sa-09-A,SA-9,A,Require that providers of external system services comply with organizational security and privacy requirements and employ the following controls: [Assignment: organization-defined controls];,
sa-09-B,SA-9,B,Define and document organizational oversight and user roles and responsibilities with regard to external system services; and,
sa-09-C,SA-9,C,"Employ the following processes, methods, and techniques to monitor control compliance by external service providers on an ongoing basis: [Assignment: organization-defined processes, methods, and techniques].",
sa-22-,SA-22,,,"Support for system components includes software patches, firmware updates, replacement parts, and maintenance contracts. An example of unsupported components includes when vendors no longer provide critical software patches or product updates, which can result in an opportunity for adversaries to exploit weaknesses in the installed components. Exceptions to replacing unsupported system components include systems that provide critical mission or business capabilities where newer technologies are not available or where the systems are so isolated that installing replacement components is not an option.

Alternative sources for support address the need to provide continued support for system components that are no longer supported by the original manufacturers, developers, or vendors when such components remain essential to organizational mission and business functions. If necessary, organizations can establish in-house support by developing customized patches for critical software components or, alternatively, obtain the services of external providers who provide ongoing support for the designated unsupported components through contractual relationships. Such contractual relationships can include open-source software value-added vendors. The increased risk of using unsupported system components can be mitigated, for example, by prohibiting the connection of such components to public or uncontrolled networks, or implementing other forms of isolation."
sa-22-A,SA-22,A,"Replace system components when support for the components is no longer available from the developer, vendor, or manufacturer; or",
sa-22-B,SA-22,B,"Provide the following options for alternative sources for continued support for unsupported components [Selection: in-house support, [Assignment: organization-defined support from external providers]].",
sc-01-,SC-1,,,"System and communications protection policy and procedures address the controls in the SC family that are implemented within systems and organizations. The risk management strategy is an important factor in establishing such policies and procedures. Policies and procedures contribute to security and privacy assurance. Therefore, it is important that security and privacy programs collaborate on the development of system and communications protection policy and procedures. Security and privacy program policies and procedures at the organization level are preferable, in general, and may obviate the need for mission- or system-specific policies and procedures. The policy can be included as part of the general security and privacy policy or be represented by multiple policies that reflect the complex nature of organizations. Procedures can be established for security and privacy programs, for mission or business processes, and for systems, if needed. Procedures describe how the policies or controls are implemented and can be directed at the individual or role that is the object of the procedure. Procedures can be documented in system security and privacy plans or in one or more separate documents. Events that may precipitate an update to system and communications protection policy and procedures include assessment or audit findings, security incidents or breaches, or changes in applicable laws, executive orders, directives, regulations, policies, standards, and guidelines. Simply restating controls does not constitute an organizational policy or procedure."
sc-01-A,SC-1,A,"Develop, document, and disseminate to [Assignment: organization-defined organization-defined personnel or roles]:",
sc-01-A.1,SC-1,A.1,"[Selection: organization-level, mission/business-process-level, system-level] system and communications protection policy that:",
sc-01-A.1.A,SC-1,A.1.A,"Addresses purpose, scope, roles, responsibilities, management commitment, coordination among organizational entities, and compliance; and",
sc-01-A.1.B,SC-1,A.1.B,"Is consistent with applicable laws, executive orders, directives, regulations, policies, standards, and guidelines; and",
sc-01-A.2,SC-1,A.2,Procedures to facilitate the implementation of the system and communications protection policy and the associated system and communications protection controls;,
sc-01-B,SC-1,B,"Designate an [Assignment: organization-defined official] to manage the development, documentation, and dissemination of the system and communications protection policy and procedures; and",
sc-01-C,SC-1,C,Review and update the current system and communications protection:,
sc-01-C.1,SC-1,C.1,Policy [Assignment: organization-defined frequency] and following [Assignment: organization-defined events] ; and,
sc-01-C.2,SC-1,C.2,Procedures [Assignment: organization-defined frequency] and following [Assignment: organization-defined events].,
sc-04-,SC-4,,Prevent unauthorized and unintended information transfer via shared system resources.,"Preventing unauthorized and unintended information transfer via shared system resources stops information produced by the actions of prior users or roles (or the actions of processes acting on behalf of prior users or roles) from being available to current users or roles (or current processes acting on behalf of current users or roles) that obtain access to shared system resources after those resources have been released back to the system. Information in shared system resources also applies to encrypted representations of information. In other contexts, control of information in shared system resources is referred to as object reuse and residual information protection. Information in shared system resources does not address information remanence, which refers to the residual representation of data that has been nominally deleted; covert channels (including storage and timing channels), where shared system resources are manipulated to violate information flow restrictions; or components within systems for which there are only single users or roles."
sc-07-,SC-7,,,"Managed interfaces include gateways, routers, firewalls, guards, network-based malicious code analysis, virtualization systems, or encrypted tunnels implemented within a security architecture. Subnetworks that are physically or logically separated from internal networks are referred to as demilitarized zones or DMZs. Restricting or prohibiting interfaces within organizational systems includes restricting external web traffic to designated web servers within managed interfaces, prohibiting external traffic that appears to be spoofing internal addresses, and prohibiting internal traffic that appears to be spoofing external addresses. [SP 800-189](#f5edfe51-d1f2-422e-9b27-5d0e90b49c72) provides additional information on source address validation techniques to prevent ingress and egress of traffic with spoofed addresses. Commercial telecommunications services are provided by network components and consolidated management systems shared by customers. These services may also include third party-provided access lines and other service elements. Such services may represent sources of increased risk despite contract security provisions. Boundary protection may be implemented as a common control for all or part of an organizational network such that the boundary to be protected is greater than a system-specific boundary (i.e., an authorization boundary)."
sc-07-A,SC-7,A,Monitor and control communications at the external managed interfaces to the system and at key internal managed interfaces within the system;,
sc-07-B,SC-7,B,"Implement subnetworks for publicly accessible system components that are [Selection: physically, logically] separated from internal organizational networks; and",
sc-07-C,SC-7,C,Connect to external networks or systems only through managed interfaces consisting of boundary protection devices arranged in accordance with an organizational security and privacy architecture.,
sc-07.05-,SC-7.5,,"Deny network communications traffic by default and allow network communications traffic by exception [Selection: at managed interfaces, for [Assignment: organization-defined systems]].","Denying by default and allowing by exception applies to inbound and outbound network communications traffic. A deny-all, permit-by-exception network communications traffic policy ensures that only those system connections that are essential and approved are allowed. Deny by default, allow by exception also applies to a system that is connected to an external system."
sc-08-,SC-8,,"Protect the [Selection: confidentiality, integrity] of transmitted information.","Protecting the confidentiality and integrity of transmitted information applies to internal and external networks as well as any system components that can transmit information, including servers, notebook computers, desktop computers, mobile devices, printers, copiers, scanners, facsimile machines, and radios. Unprotected communication paths are exposed to the possibility of interception and modification. Protecting the confidentiality and integrity of information can be accomplished by physical or logical means. Physical protection can be achieved by using protected distribution systems. A protected distribution system is a wireline or fiber-optics telecommunications system that includes terminals and adequate electromagnetic, acoustical, electrical, and physical controls to permit its use for the unencrypted transmission of classified information. Logical protection can be achieved by employing encryption techniques.

Organizations that rely on commercial providers who offer transmission services as commodity services rather than as fully dedicated services may find it difficult to obtain the necessary assurances regarding the implementation of needed controls for transmission confidentiality and integrity. In such situations, organizations determine what types of confidentiality or integrity services are available in standard, commercial telecommunications service packages. If it is not feasible to obtain the necessary controls and assurances of control effectiveness through appropriate contracting vehicles, organizations can implement appropriate compensating controls."
sc-08.01-,SC-8.1,,"Implement cryptographic mechanisms to [Selection: prevent unauthorized disclosure of information, detect changes to information] during transmission.","Encryption protects information from unauthorized disclosure and modification during transmission. Cryptographic mechanisms that protect the confidentiality and integrity of information during transmission include TLS and IPSec. Cryptographic mechanisms used to protect information integrity include cryptographic hash functions that have applications in digital signatures, checksums, and message authentication codes."
sc-10-,SC-10,,Terminate the network connection associated with a communications session at the end of the session or after [Assignment: organization-defined time period] of inactivity.,Network disconnect applies to internal and external networks. Terminating network connections associated with specific communications sessions includes de-allocating TCP/IP address or port pairs at the operating system level and de-allocating the networking assignments at the application level if multiple application sessions are using a single operating system-level network connection. Periods of inactivity may be established by organizations and include time periods by type of network access or for specific network accesses.
sc-12-,SC-12,,"Establish and manage cryptographic keys when cryptography is employed within the system in accordance with the following key management requirements: [Assignment: organization-defined requirements for key generation, distribution, storage, access, and destruction].","Cryptographic key management and establishment can be performed using manual procedures or automated mechanisms with supporting manual procedures. Organizations define key management requirements in accordance with applicable laws, executive orders, directives, regulations, policies, standards, and guidelines and specify appropriate options, parameters, and levels. Organizations manage trust stores to ensure that only approved trust anchors are part of such trust stores. This includes certificates with visibility external to organizational systems and certificates related to the internal operations of systems. [NIST CMVP](#1acdc775-aafb-4d11-9341-dc6a822e9d38) and [NIST CAVP](#84dc1b0c-acb7-4269-84c4-00dbabacd78c) provide additional information on validated cryptographic modules and algorithms that can be used in cryptographic key management and establishment."
sc-13-,SC-13,,,"Cryptography can be employed to support a variety of security solutions, including the protection of classified information and controlled unclassified information, the provision and implementation of digital signatures, and the enforcement of information separation when authorized individuals have the necessary clearances but lack the necessary formal access approvals. Cryptography can also be used to support random number and hash generation. Generally applicable cryptographic standards include FIPS-validated cryptography and NSA-approved cryptography. For example, organizations that need to protect classified information may specify the use of NSA-approved cryptography. Organizations that need to provision and implement digital signatures may specify the use of FIPS-validated cryptography. Cryptography is implemented in accordance with applicable laws, executive orders, directives, regulations, policies, standards, and guidelines."
sc-13-A,SC-13,A,Determine the [Assignment: organization-defined cryptographic uses] ; and,
sc-13-B,SC-13,B,Implement the following types of cryptography required for each specified cryptographic use: [Assignment: organization-defined types of cryptography for each specified cryptographic use].,
sc-15-,SC-15,,,"Collaborative computing devices and applications include remote meeting devices and applications, networked white boards, cameras, and microphones. The explicit indication of use includes signals to users when collaborative computing devices and applications are activated."
sc-15-A,SC-15,A,Prohibit remote activation of collaborative computing devices and applications with the following exceptions: [Assignment: organization-defined exceptions where remote activation is to be allowed] ; and,
sc-15-B,SC-15,B,Provide an explicit indication of use to users physically present at the devices.,
sc-18-,SC-18,,,"Mobile code includes any program, application, or content that can be transmitted across a network (e.g., embedded in an email, document, or website) and executed on a remote system. Decisions regarding the use of mobile code within organizational systems are based on the potential for the code to cause damage to the systems if used maliciously. Mobile code technologies include Java applets, JavaScript, HTML5, WebGL, and VBScript. Usage restrictions and implementation guidelines apply to both the selection and use of mobile code installed on servers and mobile code downloaded and executed on individual workstations and devices, including notebook computers and smart phones. Mobile code policy and procedures address specific actions taken to prevent the development, acquisition, and introduction of unacceptable mobile code within organizational systems, including requiring mobile code to be digitally signed by a trusted source."
sc-18-A,SC-18,A,Define acceptable and unacceptable mobile code and mobile code technologies; and,
sc-18-B,SC-18,B,"Authorize, monitor, and control the use of mobile code within the system.",
sc-23-,SC-23,,Protect the authenticity of communications sessions.,"Protecting session authenticity addresses communications protection at the session level, not at the packet level. Such protection establishes grounds for confidence at both ends of communications sessions in the ongoing identities of other parties and the validity of transmitted information. Authenticity protection includes protecting against ""man-in-the-middle"" attacks, session hijacking, and the insertion of false information into sessions."
